{
  "schema_version": "0.1",
  "dataset_name": "empty-smoke-dataset",
  "description": "Empty example dataset for exercising the P0-W1 runner without student data.",
  "samples_source": "raw",
  "ground_truth": "ground_truth/ground_truth.example.jsonl",
  "notes": "No real student images or labels are included in this smoke example."
}
